{
  "version": 1,
  "revision": 1,
  "visibility": "author_only",
  "status": "draft",
  "purpose": "source_first_connected_story_not_game_runtime",
  "sequence_policy": "editorial_linear_order_with_original_conditional_variants",
  "priority": "preserve_every_original_occurrence_and_display_event",
  "chapters": "storyboard/chapters.json",
  "macro_stories": "storyboard/chapter-stories.json",
  "origin": "authored",
  "metadata": {
    "addition": true,
    "kind": "new_setting",
    "note": "추가: 원작 전체 문구를 빠짐없이 연결하여 검토하기 위한 선형 집필 배열. 원작 강제 순서·단일 정사·전체 분기 구현이 아니다.",
    "knowledge_policy": "author_reference_not_character_knowledge"
  },
  "sections": [
    {
      "id": "01-invitation",
      "chapter_id": "chapter01",
      "title": [
        {
          "text": "다른 지구에서 온 초대"
        }
      ],
      "selectors": [
        {
          "file": "LOREHELP.PAS",
          "line_start": 11,
          "line_end": 28
        },
        {
          "file": "LOREHELP.PAS",
          "line_start": 221,
          "line_end": 226
        }
      ],
      "show_literal_text": true,
      "before": [
        {
          "text": "이야기는 성주의 명령보다 앞서, 다른 세계로 부르는 글에서 시작된다. 같은 시간을 살아가지만 다른 길로 진화한 지구, 그곳에서 피할 수 없다고 일컬어지는 운명이 읽는 이를 기다린다. 초대하는 목소리는 앞으로 거칠 대륙의 풍경과 동료의 존재를 함께 내다본다."
        }
      ],
      "after": [
        {
          "text": "초대의 글은 이 세계에 들어온 사람이 앞으로 마주할 길을 먼저 펼쳐 보인다. 다른 공간에서 온 적 때문에 고통받는 사람들이 있고, 그 운명을 벗어나려고 누군가를 불렀다는 말이 남는다. 이제 이야기는 성 안의 만남으로 들어간다. 이 초대가 말한 사정은 그곳 사람들의 목소리와, 나중에 발견하는 기록 속에서 다시 이어진다."
        }
      ],
      "origin": "authored",
      "status": "proposed",
      "metadata": {
        "addition": true,
        "kind": "new_setting",
        "note": "추가: 원작 타이틀의 초대문과 운명의 글을 앞머리에 배치하는 편집 연결. 타이틀/제작자의 목소리를 성주의 대사나 등장인물의 자동 지식으로 바꾸지 않는다.",
        "knowledge_policy": "author_reference_not_character_knowledge"
      }
    },
    {
      "id": "01-audience",
      "chapter_id": "chapter01",
      "title": [
        {
          "text": "성주가 들려주는 재앙"
        }
      ],
      "selectors": [
        {
          "file": "LORETALK.PAS",
          "line_start": 299,
          "line_end": 338
        }
      ],
      "before": [
        {
          "text": "성에 들어온 "
        },
        {
          "ref": {
            "catalog": "characters",
            "id": "protagonist",
            "particle": "은/는"
          }
        },
        {
          "text": " 먼저 "
        },
        {
          "ref": {
            "catalog": "characters",
            "id": "lord_ahn"
          }
        },
        {
          "text": " 앞에 선다. 사라진 사람들의 사정을 듣기 전까지는 낯선 성을 나서면 어디로 가야 할지도 알지 못한다. 성주가 말하는 재앙과 특공대의 파견을 그 자리에서 듣는다."
        }
      ],
      "after": [
        {
          "text": "자기에게 닥친 일만이 아닌 싸움의 크기를 알게 된다. 그러나 아직 돌아오지 않은 특공대의 생사는 성주도 답하지 못한다. 일행이 첫걸음으로 맡을 일은 그보다 가까운 곳에 있다."
        }
      ],
      "origin": "authored",
      "status": "proposed",
      "metadata": {
        "addition": true,
        "kind": "new_setting",
        "note": "추가: 보존 원문 사이의 이동·대기·동기를 이어 쓴 집필용 연결. 아래 원문 조건을 없애거나 모든 배타 경로를 동시에 겪었다는 뜻이 아니다.",
        "knowledge_policy": "author_reference_not_character_knowledge"
      }
    },
    {
      "id": "01-request",
      "chapter_id": "chapter01",
      "title": [
        {
          "text": "첫 의뢰와 문 앞의 대답"
        }
      ],
      "selectors": [
        {
          "file": "LORETALK.PAS",
          "line_start": 260,
          "line_end": 298
        },
        {
          "file": "LORETALK.PAS",
          "line_start": 339,
          "line_end": 358
        }
      ],
      "before": [
        {
          "text": "성주는 일행의 힘을 직접 본 적이 없다. 멀리 있는 적을 처단하라는 명령 대신 "
        },
        {
          "ref": {
            "catalog": "terms",
            "id": "menace"
          }
        },
        {
          "text": "의 중심을 확인하고 돌아오라는 부탁을 꺼낸다. 문 앞의 응답은 서로 다른 원작 조건으로 남기되, 이 초고의 앞으로 나아가는 흐름은 의뢰 수락으로 잇는다."
        }
      ],
      "after": [
        {
          "text": "의뢰를 맡은 일행은 바로 동굴에 던져지지 않는다. 무기를 가져가도 된다는 허락과, 준비를 살필 시간이 있다. 돌아올 길까지 생각해야 하는 첫 출발이다."
        }
      ],
      "origin": "authored",
      "status": "proposed",
      "metadata": {
        "addition": true,
        "kind": "new_setting",
        "note": "추가: 보존 원문 사이의 이동·대기·동기를 이어 쓴 집필용 연결. 아래 원문 조건을 없애거나 모든 배타 경로를 동시에 겪었다는 뜻이 아니다.",
        "knowledge_policy": "author_reference_not_character_knowledge"
      }
    },
    {
      "id": "01-city",
      "chapter_id": "chapter01",
      "title": [
        {
          "text": "성 안에서 들은 서로 다른 말"
        }
      ],
      "selectors": [
        {
          "file": "LORETALK.PAS",
          "line_start": 17,
          "line_end": 259
        },
        {
          "file": "LOREENT.PAS",
          "line_start": 396,
          "line_end": 412
        }
      ],
      "before": [
        {
          "text": "준비하는 동안 성 안의 사람들을 만난다. 주점의 웃음 뒤에는 돌아오지 않은 친구들을 기다리는 말이 있고, 수감소에는 다른 믿음을 말하다 갇힌 사람도 있다. "
        },
        {
          "ref": {
            "catalog": "characters",
            "id": "jr_antares"
          }
        },
        {
          "text": "의 말은 앞으로 만날 "
        },
        {
          "ref": {
            "catalog": "characters",
            "id": "red_antares"
          }
        },
        {
          "text": "에게 이어지고, 도둑의 증언은 동굴의 방패를 찾는 단서가 된다."
        }
      ],
      "after": [
        {
          "text": "누구의 말을 들었느냐에 따라 처음 동굴에 들어갈 때 품은 생각은 달라진다. 성주의 설명만으로는 성 안의 모든 사정을 알 수 없다. 이곳에서 만난 사람의 말은 이후의 만남과 장비 발견에서 다시 뜻을 얻는다."
        }
      ],
      "origin": "authored",
      "status": "proposed",
      "metadata": {
        "addition": true,
        "kind": "new_setting",
        "note": "추가: 보존 원문 사이의 이동·대기·동기를 이어 쓴 집필용 연결. 아래 원문 조건을 없애거나 모든 배타 경로를 동시에 겪었다는 뜻이 아니다.",
        "knowledge_policy": "author_reference_not_character_knowledge"
      }
    },
    {
      "id": "01-depart",
      "chapter_id": "chapter01",
      "title": [
        {
          "text": "무기고와 성문, 첫 동행"
        }
      ],
      "selectors": [
        {
          "file": "LORESPEC.PAS",
          "line_start": 190,
          "line_end": 305
        },
        {
          "file": "LOREENT.PAS",
          "line_start": 17,
          "line_end": 51
        },
        {
          "file": "LORESPEC.PAS",
          "line_start": 25,
          "line_end": 36
        }
      ],
      "before": [
        {
          "text": "무기고의 도움을 받아 실제 장비를 정한 뒤 성문으로 향한다. 수감소에서 누군가를 데리고 나온 경로에는 병사들과의 충돌이 따르고, 성을 떠나는 자리에서는 "
        },
        {
          "ref": {
            "catalog": "characters",
            "id": "skeleton"
          }
        },
        {
          "text": "이 말을 건넨다. 사람의 생김새와 성 안에서 들은 평가가 그의 말을 대신할 수는 없다."
        }
      ],
      "after": [
        {
          "text": "영입했다는 말만으로 끝나는 것이 아니다. 누가 지금 동행하는지, 누가 전투 때 떠났는지 구별한 채 성 밖으로 나간다. 동쪽의 나무에서 식량을 얻는 방문도 실제로 한 경우에만 준비에 남는다."
        }
      ],
      "origin": "authored",
      "status": "proposed",
      "metadata": {
        "addition": true,
        "kind": "new_setting",
        "note": "추가: 보존 원문 사이의 이동·대기·동기를 이어 쓴 집필용 연결. 아래 원문 조건을 없애거나 모든 배타 경로를 동시에 겪었다는 뜻이 아니다.",
        "knowledge_policy": "author_reference_not_character_knowledge"
      }
    },
    {
      "id": "01-cave",
      "chapter_id": "chapter01",
      "title": [
        {
          "text": "중심을 확인하고 되돌아오는 길"
        }
      ],
      "selectors": [
        {
          "file": "LORESPEC.PAS",
          "line_start": 814,
          "line_end": 878
        }
      ],
      "before": [
        {
          "text": "남서쪽으로 걸어 "
        },
        {
          "ref": {
            "catalog": "terms",
            "id": "menace"
          }
        },
        {
          "text": "에 들어선다. 금광이었다는 주민의 말과 수감소에서 들은 숨은 물건의 위치는, 들은 경로에서만 길을 살피는 이유가 된다. 일행이 반드시 해내야 할 것은 중심에 닿아 확인하는 일이다."
        }
      ],
      "after": [
        {
          "text": "중심에 도착한 일행은 더 깊이 싸움을 찾아가는 대신 돌아갈 방향으로 몸을 돌린다. 원작의 금과 방패는 발견 조건과 장착 대상을 보존한다. 탐사가 성공했다는 보고는 실제 중심에 닿은 뒤에야 가능하다."
        }
      ],
      "origin": "authored",
      "status": "proposed",
      "metadata": {
        "addition": true,
        "kind": "new_setting",
        "note": "추가: 보존 원문 사이의 이동·대기·동기를 이어 쓴 집필용 연결. 아래 원문 조건을 없애거나 모든 배타 경로를 동시에 겪었다는 뜻이 아니다.",
        "knowledge_policy": "author_reference_not_character_knowledge"
      }
    },
    {
      "id": "01-report",
      "chapter_id": "chapter01",
      "title": [
        {
          "text": "첫 보고와 다음 부탁"
        }
      ],
      "selectors": [
        {
          "file": "LORETALK.PAS",
          "line_start": 359,
          "line_end": 382
        }
      ],
      "before": [
        {
          "text": "출발했던 성으로 돌아와 본 것을 전한다. 성주는 탐사 결과를 듣고 보상을 주며, 처음에는 몰랐던 일행의 능력을 이제 믿겠다고 말한다."
        }
      ],
      "after": [
        {
          "text": "그 믿음은 여행의 끝이 아니라 더 큰 임무의 시작이다. "
        },
        {
          "ref": {
            "catalog": "terms",
            "id": "lastditch"
          }
        },
        {
          "text": "의 근심을 해결하라는 부탁을 받은 일행은 대륙의 동쪽으로 향한다. 특공대와 재앙에 관한 처음의 질문도 아직 함께 가져간다."
        }
      ],
      "origin": "authored",
      "status": "proposed",
      "metadata": {
        "addition": true,
        "kind": "new_setting",
        "note": "추가: 보존 원문 사이의 이동·대기·동기를 이어 쓴 집필용 연결. 아래 원문 조건을 없애거나 모든 배타 경로를 동시에 겪었다는 뜻이 아니다.",
        "knowledge_policy": "author_reference_not_character_knowledge"
      }
    },
    {
      "id": "02-town",
      "chapter_id": "chapter02",
      "title": [
        {
          "text": "쌍둥이 성과 기다리는 사람"
        }
      ],
      "selectors": [
        {
          "file": "LOREENT.PAS",
          "line_start": 413,
          "line_end": 420
        },
        {
          "file": "LORETALK.PAS",
          "line_start": 384,
          "line_end": 406
        }
      ],
      "before": [
        {
          "ref": {
            "catalog": "terms",
            "id": "lastditch"
          }
        },
        {
          "text": "에 들어오면 쌍둥이 성과 대륙 사이의 문 이야기를 듣는다. 이곳에는 특공대 지휘관을 남편이라고 말하는 사람도 있다. 처음 성에서 들었던 파견은 이제 기다리는 한 사람의 생활과 닿는다."
        }
      ],
      "after": [